{
  "$schema": "https://json-schema.org/draft/2020-12/schema",
  "$id": "https://rivoli-ai.com/schemas/andy-cli/headless-config.v1.json",
  "title": "Andy CLI headless run config v1",
  "description": "Schema for the config file consumed by `andy-cli run --headless --config <path>`. Every field here is applied or verified by the runtime; there are no silent no-ops. `policy_id` and `boundaries` were REMOVED from v1 because the runtime enforced neither and their presence created false security assurance (rivoli-ai/andy-cli#180) - configs carrying them are now rejected as unknown properties. See docs/headless-runtime.md, docs/adr/0002-headless-v1-inactive-fields.md, and Epic AQ (rivoli-ai/andy-cli#44) for the full semantics.",
  "type": "object",
  "required": [
    "schema_version",
    "run_id",
    "agent",
    "model",
    "tools",
    "workspace",
    "output",
    "limits"
  ],
  "additionalProperties": false,
  "properties": {
    "verification": {
      "type": "object",
      "additionalProperties": false,
      "description": "Build/test publication gate. Without commands, verify changed .NET sources automatically through execute_command permissions.",
      "properties": {
        "commands": {
          "type": "array",
          "minItems": 1,
          "maxItems": 8,
          "items": {
            "type": "string",
            "minLength": 1,
            "maxLength": 4096
          }
        },
        "max_attempts": {
          "type": "integer",
          "minimum": 1,
          "maximum": 3,
          "default": 2
        },
        "timeout_seconds": {
          "type": "integer",
          "minimum": 1,
          "maximum": 300,
          "default": 120
        }
      }
    },
    "schema_version": {
      "const": 1,
      "description": "Schema version. Bump to 2 introduces a new schema file (v2.json) and a separate compatibility layer; do not overload v1."
    },
    "run_id": {
      "type": "string",
      "format": "uuid",
      "description": "Correlates stdout events and artifacts with the andy-containers Run entity (rivoli-ai/andy-containers#103)."
    },
    "agent": {
      "type": "object",
      "required": ["slug", "instructions"],
      "additionalProperties": false,
      "properties": {
        "slug": {
          "type": "string",
          "pattern": "^[a-z][a-z0-9-]{1,63}$",
          "description": "Agent identifier from andy-agents (Epic W W5 seed). Lowercase ASCII, dash-separated, 2-64 chars."
        },
        "revision": {
          "type": "integer",
          "minimum": 1,
          "description": "Optional pin to a specific agent revision. Null/absent = head."
        },
        "instructions": {
          "type": "string",
          "minLength": 1,
          "maxLength": 100000,
          "description": "Resolved system prompt: agent.instructions concatenated with delegation_contract.objective."
        },
        "output_format": {
          "type": "string",
          "description": "Enforced format for the agent's final output. A label beginning with 'json' (case-insensitive, e.g. 'json', 'json-triage-output-v1') requires the final output to be syntactically valid JSON; the run fails (exit 1) if it is not. Any other label (e.g. 'plain') is treated as free-form and not enforced by the runtime."
        }
      }
    },
    "model": {
      "type": "object",
      "required": ["provider", "id"],
      "additionalProperties": false,
      "properties": {
        "provider": {
          "enum": ["anthropic", "openai", "openrouter", "google", "cerebras", "groq", "local"],
          "description": "LLM provider. Pluggable via Andy.Llm adapter registry."
        },
        "id": {
          "type": "string",
          "minLength": 1,
          "description": "Model identifier as recognised by the provider (e.g. 'claude-sonnet-4-6', 'gpt-5-medium')."
        },
        "api_key_ref": {
          "type": "string",
          "pattern": "^env:[A-Za-z_][A-Za-z0-9_]*$",
          "description": "How to resolve the API key. The ONLY form implemented in v1 is 'env:NAME' (read env var NAME). 'secret-store:NAME' and bare key values are rejected at load time (exit 2). When present, the referenced env var's value is loaded into the provider's API key; the value is never logged or emitted."
        }
      }
    },
    "tools": {
      "type": "array",
      "description": "Concrete tool bindings this run is allowed to call, resolved from the agent's skills × allowed_tools.",
      "items": {
        "oneOf": [
          {
            "type": "object",
            "title": "MCP tool binding",
            "required": ["name", "transport", "endpoint"],
            "additionalProperties": false,
            "properties": {
              "name": {
                "type": "string",
                "pattern": "^[a-z][a-z0-9_.-]*$",
                "description": "Tool identifier as seen by the agent."
              },
              "transport": { "const": "mcp" },
              "endpoint": {
                "type": "string",
                "format": "uri",
                "description": "mcp-gateway URL for this tool (usually $ANDY_MCP_URL/<tool-name>)."
              }
            }
          },
          {
            "type": "object",
            "title": "CLI tool binding",
            "required": ["name", "transport", "binary"],
            "additionalProperties": false,
            "properties": {
              "name": {
                "type": "string",
                "pattern": "^[a-z][a-z0-9_.-]*$"
              },
              "transport": { "const": "cli" },
              "binary": {
                "type": "string",
                "description": "Executable name resolved via $PATH (e.g. 'andy-tasks-cli')."
              },
              "command": {
                "type": "array",
                "items": { "type": "string" },
                "description": "Default argv the agent prepends. The agent appends its own args."
              }
            }
          }
        ]
      }
    },
    "workspace": {
      "type": "object",
      "required": ["root"],
      "additionalProperties": false,
      "properties": {
        "root": {
          "type": "string",
          "description": "Absolute path inside the container to the mounted workspace (typically /workspace)."
        },
        "branch": {
          "type": "string",
          "description": "Git branch the run is expected to operate on. The container runtime checks this branch out before launch; the headless runtime VERIFIES it: if set, workspace.root must be a git work tree whose current branch matches, otherwise the run fails fast (exit 1). It does not itself check out or switch branches."
        }
      }
    },
    "env_vars": {
      "type": "object",
      "additionalProperties": { "type": "string" },
      "description": "Additional env vars set into the agent process environment before provider/tool wiring. Reserved names MUST NOT appear here; a config that tries to shadow one is rejected at load time (exit 2). Two families are reserved: container-runtime identity (ANDY_PROXY_URL, ANDY_TOKEN, ANDY_MCP_URL), and permission-engine controls read when the fail-closed permission gate is built (ANDY_PERMISSION_MODE, ANDY_PERMISSIONS_FILE, ANDY_PERMISSIONS_JSON)."
    },
    "output": {
      "type": "object",
      "required": ["file", "stream"],
      "additionalProperties": false,
      "properties": {
        "file": {
          "type": "string",
          "description": "Path to write the final structured output. Atomic write (tmp + rename). Absent on failure before output stage."
        },
        "stream": {
          "enum": ["stdout", "fifo"],
          "description": "Where the structured event stream goes. 'stdout' (default) writes NDJSON to standard output; 'fifo' writes it to the named FIFO at event_sink.path, which then becomes REQUIRED (see the top-level allOf/if-then). The runtime opens that path for writing and streams every event to it."
        }
      }
    },
    "event_sink": {
      "type": "object",
      "additionalProperties": false,
      "properties": {
        "nats_subject": {
          "type": "string",
          "pattern": "^andy\\.containers\\.events\\.run\\.[0-9a-f-]+\\.[a-z_]+$",
          "description": "NATS subject the container runtime (Epic AP6) will fan events to. Agent does not publish directly."
        },
        "path": {
          "type": "string",
          "minLength": 1,
          "description": "Absolute path to a named FIFO. Required when output.stream == 'fifo'; the runtime opens it for writing and streams every event to it."
        }
      }
    },
    "transcript": {
      "type": "object",
      "additionalProperties": false,
      "description": "Optional durable diagnostic transcript. Presence enables an atomic, uniquely named NDJSON file keyed by run_id. Records are redacted and bounded before persistence; retention cleanup is deterministic.",
      "properties": {
        "directory": {
          "type": "string",
          "minLength": 1,
          "description": "Absolute transcript directory. Defaults to <workspace.root>/.andy/transcripts."
        },
        "max_record_bytes": {
          "type": "integer",
          "minimum": 1024,
          "maximum": 1048576,
          "default": 65536,
          "description": "Maximum UTF-8 bytes retained for one record. Larger records become a redacted preview plus digest."
        },
        "max_run_bytes": {
          "type": "integer",
          "minimum": 4096,
          "maximum": 268435456,
          "default": 4194304,
          "description": "Maximum UTF-8 bytes for one transcript, including its terminal record."
        },
        "max_age_days": {
          "type": "integer",
          "minimum": 1,
          "maximum": 3650,
          "default": 14,
          "description": "Delete completed transcripts older than this many days."
        },
        "max_files": {
          "type": "integer",
          "minimum": 1,
          "maximum": 10000,
          "default": 200,
          "description": "Maximum completed transcript files retained in the directory."
        },
        "max_total_bytes": {
          "type": "integer",
          "minimum": 4096,
          "maximum": 1073741824,
          "default": 268435456,
          "description": "Maximum total bytes retained across completed transcripts."
        },
        "redact_env_vars": {
          "type": "array",
          "maxItems": 64,
          "uniqueItems": true,
          "items": {
            "type": "string",
            "pattern": "^[A-Za-z_][A-Za-z0-9_]*$"
          },
          "description": "Additional environment variable names whose resolved values must be removed from persisted records. model.api_key_ref and ANDY_TOKEN are always included."
        }
      }
    },
    "permissions": {
      "type": "object",
      "additionalProperties": false,
      "description": "AX.4 (rivoli-ai/conductor#2091) per-run permission allow-list. Headless is fail-closed: mutating built-ins (write_file/delete_file/move_file/copy_file/file_editor/replace_text/create_directory) and execute_command default to deny. Tools listed here are relaxed to allow (injected above the builtin defaults); everything else stays denied. Absent = unchanged fail-closed behavior. Populated by AX.9/andy-containers from the resolved policy.",
      "properties": {
        "allowed_tools": {
          "type": "array",
          "uniqueItems": true,
          "items": {
            "type": "string",
            "pattern": "^[a-z][a-z0-9_.-]*$"
          },
          "description": "Tool ids the run is permitted to execute (e.g. 'write_file', 'execute_command'). A normally-Ask tool becomes executable when listed; a tool not listed stays denied. Empty grants nothing beyond auto-allowed read-only built-ins."
        }
      }
    },
    "required_actions": {
      "type": "array",
      "maxItems": 32,
      "uniqueItems": true,
      "description": "Bounded machine-checkable actions that must succeed before output publication. Requirements are evaluated from actual observed tool outcomes, never from model claims. Absent or empty preserves the existing success contract.",
      "items": {
        "type": "object",
        "required": ["tool_name"],
        "additionalProperties": false,
        "properties": {
          "tool_name": {
            "type": "string",
            "pattern": "^[a-z][a-z0-9_.-]*$",
            "description": "Tool that must complete successfully."
          },
          "command_equals": {
            "type": "string",
            "minLength": 1,
            "maxLength": 4096,
            "pattern": "^[^\\u0000-\\u001f\\u007f*?\\[\\]]+$",
            "description": "Optional exact normalized command match. Valid only for execute_command; glob-like patterns, control characters, and multi-line values are rejected. Regular-expression syntax is never interpreted."
          },
          "at_least": {
            "type": "integer",
            "minimum": 1,
            "maximum": 100,
            "default": 1,
            "description": "Minimum number of matching successful terminal outcomes."
          }
        }
      }
    },
    "limits": {
      "type": "object",
      "required": ["max_iterations", "timeout_seconds"],
      "additionalProperties": false,
      "properties": {
        "max_iterations": {
          "type": "integer",
          "minimum": 1,
          "maximum": 10000,
          "description": "Hard cap on agent loop iterations. Exceeded = exit code 4 (timeout)."
        },
        "timeout_seconds": {
          "type": "integer",
          "minimum": 1,
          "maximum": 86400,
          "description": "Wall-clock timeout. Exceeded = exit code 4 (timeout)."
        },
        "max_output_tokens": {
          "type": "integer",
          "minimum": 256,
          "maximum": 131072,
          "description": "Initial per-response output-token allowance. Omitted preserves the 4096-token default."
        },
        "continuation_window_iterations": {
          "type": "integer",
          "minimum": 1,
          "maximum": 10000,
          "description": "Optional per-window turn budget. max_iterations remains the global turn ceiling."
        },
        "engine_timeout_seconds": {
          "type": "integer",
          "minimum": 1,
          "maximum": 86399,
          "description": "Optional Engine wall-clock ceiling. Must be smaller than timeout_seconds to preserve CLI cleanup margin."
        }
      }
    }
  },
  "allOf": [
    {
      "$comment": "Cross-field requirement: FIFO event streaming needs a sink path. When output.stream is 'fifo', event_sink.path must be present so the runtime knows where to write the event stream.",
      "if": {
        "required": ["output"],
        "properties": {
          "output": {
            "required": ["stream"],
            "properties": { "stream": { "const": "fifo" } }
          }
        }
      },
      "then": {
        "required": ["event_sink"],
        "properties": {
          "event_sink": {
            "required": ["path"],
            "properties": { "path": { "type": "string", "minLength": 1 } }
          }
        }
      }
    }
  ]
}
